{
  "schema_version": 1,
  "disposition_id": "DSP-2026-09-0001",
  "run_id": "RUN-2026-09-0001",
  "decision": "accepted",
  "issued_at": "2026-09-06T12:00:00Z",
  "issued_by": {
    "actor_id": "local-operator",
    "actor_type": "human",
    "display_name": "Local Operator"
  },
  "evidence_ids": ["EVD-2026-09-0001"],
  "reason": "All required validation gates passed."
}
